{
  "generated_at": "2026-03-13T13:40:00Z",
  "workspace": "/Users/mac/Desktop/AIOS",
  "stage": "full",
  "execution_mode": "execute",
  "overall_status": "passed",
  "host_target": "x86_64-unknown-linux-gnu",
  "bin_dir": "/Users/mac/Desktop/AIOS/aios/target/x86_64-unknown-linux-gnu/debug",
  "keep_going": false,
  "json_report": "/Users/mac/Desktop/AIOS/out/validation/full-regression-report.json",
  "markdown_report": "/Users/mac/Desktop/AIOS/out/validation/full-regression-report.md",
  "step_logs_dir": "/Users/mac/Desktop/AIOS/out/validation/full-regression-report-logs",
  "duration_seconds": 182.4,
  "step_counts": {
    "planned": 0,
    "passed": 3,
    "failed": 0,
    "skipped": 0
  },
  "steps": [
    {
      "name": "Validate task metadata",
      "command": "python3 scripts/sync-aios-task-metadata.py --check",
      "cwd": "/Users/mac/Desktop/AIOS",
      "env_overrides": {},
      "status": "passed",
      "returncode": 0,
      "duration_seconds": 0.143,
      "stdout_log": "/Users/mac/Desktop/AIOS/out/validation/full-regression-report-logs/01-validate-task-metadata.stdout.log",
      "stderr_log": "/Users/mac/Desktop/AIOS/out/validation/full-regression-report-logs/01-validate-task-metadata.stderr.log",
      "detail": "returncode=0"
    },
    {
      "name": "Run full system delivery validation",
      "command": "python3 scripts/test-system-delivery-validation.py",
      "cwd": "/Users/mac/Desktop/AIOS",
      "env_overrides": {},
      "status": "passed",
      "returncode": 0,
      "duration_seconds": 151.865,
      "stdout_log": "/Users/mac/Desktop/AIOS/out/validation/full-regression-report-logs/02-run-full-system-delivery-validation.stdout.log",
      "stderr_log": "/Users/mac/Desktop/AIOS/out/validation/full-regression-report-logs/02-run-full-system-delivery-validation.stderr.log",
      "detail": "returncode=0"
    },
    {
      "name": "Run release gate",
      "command": "python3 scripts/check-release-gate.py",
      "cwd": "/Users/mac/Desktop/AIOS",
      "env_overrides": {},
      "status": "passed",
      "returncode": 0,
      "duration_seconds": 0.288,
      "stdout_log": "/Users/mac/Desktop/AIOS/out/validation/full-regression-report-logs/03-run-release-gate.stdout.log",
      "stderr_log": "/Users/mac/Desktop/AIOS/out/validation/full-regression-report-logs/03-run-release-gate.stderr.log",
      "detail": "returncode=0"
    }
  ],
  "declared_steps": [
    "Validate task metadata",
    "Run full system delivery validation",
    "Run release gate"
  ]
}
